Kapunda Homes,Barossa Hills Fleurieu Local Health Network Incorporated,#7831d8,Residential,26,"32 NASH Street, KAPUNDA, SA, 5373",SA,KAPUNDA,5373,State Government,Inner Regional Australia,"Yorke, Lower North & Barossa",Light,-34.331997,138.922800999999,3198720.65
Restvale Hostel,Lobethal and District Aged Homes Inc,#4fb9de,Residential,38,"8 Woodside Road, LOBETHAL, SA, 5241",SA,LOBETHAL,5241,Community Based,Inner Regional Australia,"Hills, Mallee & Southern",Adelaide Hills,-34.908883,138.87447,3898852.43
Walara Balaklava Millcourt,WALARA INCORPORATED,#31d85d,Residential,40,"7 Railway Terrace, BALAKLAVA, SA, 5461",SA,BALAKLAVA,5461,Community Based,Inner Regional Australia,"Yorke, Lower North & Barossa",Wakefield,-34.145017,138.414062999999,4832659.27
Riverview Lutheran Rest Home,Riverview Lutheran Rest Home Inc,#25b6c1,Residential,60,"5 Luther Road, LOXTON, SA, 5333",SA,LOXTON,5333,Religious,Outer Regional Australia,Riverland,Loxton Waikerie,-34.44548,140.576571,6851176.03
Mt View Homes Inc,"Mt View"""""""""""""""" Homes Inc",#4f83de,Residential,30,"31 Arthur Street, BOOLEROO CENTRE, SA, 5482",SA,BOOLEROO CENTRE,5482,Community Based,Outer Regional Australia,Mid North,Mount Remarkable,-32.8800439999999,138.351810999999,3607521.16
Longridge Aged Care,Naracoorte Home for the Aged Inc,#3136d8,Residential,52,"900 Attiwill Street, NARACOORTE, SA, 5271",SA,NARACOORTE,5271,Community Based,Outer Regional Australia,South East,Naracoorte Lucindale,-36.970658,140.748061,6092149.26
Orroroo Community Home,Yorke and Northern Local Health Network Incorporated,#31d887,Residential,16,"32 Fifth Street, ORROROO, SA, 5431",SA,ORROROO,5431,State Government,Outer Regional Australia,Mid North,Orroroo Carrieton,-32.7342999999999,138.613616,2681097.54
UnitingSA Wesley House Aged Care,UnitingSA Ltd,#d6de4f,Residential,168,"324 Military Road, SEMAPHORE PARK, SA, 5019",SA,SEMAPHORE PARK,5019,Religious,Major Cities of Australia,Metropolitan West,Charles Sturt,-34.856577,138.479052999999,19674357.73
Barunga Village Incorporated,Barunga Village Incorporated,#d831a6,Residential,87,"11 Edmund Street, PORT BROUGHTON, SA, 5522",SA,PORT BROUGHTON,5522,Community Based,Outer Regional Australia,"Yorke, Lower North & Barossa",Barunga West,-33.601818,137.932561999999,9932162.52
Resthaven Bellevue Heights,Resthaven Inc,#de4fda,Residential,102,"47 Eve Road, BELLEVUE HEIGHTS, SA, 5050",SA,BELLEVUE HEIGHTS,5050,Charitable,Major Cities of Australia,Metropolitan South,Mitcham,-35.033662,138.584924999999,10563124.01
Resthaven Murray Bridge,Resthaven Inc,#de4fda,Residential,98,"53 Swanport Road, MURRAY BRIDGE, SA, 5253",SA,MURRAY BRIDGE,5253,Charitable,Inner Regional Australia,"Hills, Mallee & Southern",Murray Bridge,-35.1252599999999,139.276351,11002456.71
Linsell Lodge Aged Care Facility,The Salvation Army (South Australia) Property Trust,#253fc1,Residential,95,"2-16 Cardigan Street, ANGLE PARK, SA, 5010",SA,ANGLE PARK,5010,Religious,Major Cities of Australia,Metropolitan West,Port Adelaide Enfield,-34.8549429999999,138.557274,11062823.23
Regis Burnside,Regis Aged Care Pty Ltd,#c12569,Residential,191,"6 Booth Avenue, LINDEN PARK, SA, 5065",SA,LINDEN PARK,5065,Private Incorporated Body,Major Cities of Australia,Metropolitan East,Burnside,-34.9434469999999,138.648587999999,19423013.44
Bethsalem Care,Christadelphian Care Services (SA) Incorporated,#934fde,Residential,90,"10 Education Road, HAPPY VALLEY, SA, 5159",SA,HAPPY VALLEY,5159,Religious,Major Cities of Australia,Metropolitan South,Onkaparinga,-35.0903509999999,138.584832,10480851.85
Bupa Campbelltown,Bupa Aged Care Australia Pty Ltd,#31d83b,Residential,59,"1 Steele Street, CAMPBELLTOWN, SA, 5074",SA,CAMPBELLTOWN,5074,Private Incorporated Body,Major Cities of Australia,Metropolitan East,Campbelltown (SA),-34.881627,138.663365999999,6601851.31
The Philip Kennedy Centre Residential Care,Southern Cross Care (SA NT & VIC) Incorporated,#4f80de,Residential,170,"477-479 Military Road, LARGS BAY, SA, 5016",SA,LARGS BAY,5016,Religious,Major Cities of Australia,Metropolitan West,Port Adelaide Enfield,-34.82448,138.489516,18782703.08
Lourdes Valley The Lodge Residential Care,Southern Cross Care (SA NT & VIC) Incorporated,#4f80de,Residential,58,"18 Cross Road, MYRTLE BANK, SA, 5064",SA,MYRTLE BANK,5064,Religious,Major Cities of Australia,Metropolitan East,Unley,-34.962735,138.639524999999,5321080.36
Mount Carmel Residential Care,Southern Cross Care (SA NT & VIC) Incorporated,#4f80de,Residential,83,"740 Torrens Road, ROSEWATER, SA, 5013",SA,ROSEWATER,5013,Religious,Major Cities of Australia,Metropolitan West,Charles Sturt,-34.8596539999999,138.523640999999,9636865.14
Fullarton Residential Care,Southern Cross Care (SA NT & VIC) Incorporated,#4f80de,Residential,60,"345 Fullarton Road, FULLARTON, SA, 5063",SA,FULLARTON,5063,Religious,Major Cities of Australia,Metropolitan East,Unley,-34.952823,138.625107,6673400.41
The Pines Lodge Residential Care,Southern Cross Care (SA NT & VIC) Incorporated,#4f80de,Residential,144,"342 Marion Road, NORTH PLYMPTON, SA, 5037",SA,NORTH PLYMPTON,5037,Religious,Major Cities of Australia,Metropolitan West,West Torrens,-34.955779,138.552992999999,16015755.25
The Willochra Home,Barunga Village Incorporated,#d831a6,Residential,42,"8 Allan Street, CRYSTAL BROOK, SA, 5523",SA,CRYSTAL BROOK,5523,Community Based,Outer Regional Australia,Mid North,Port Pirie,-33.3581849999999,138.206401,4786739.96
Tanunda Lutheran Home,Tanunda Lutheran Home Inc,#4fd8de,Residential,120,"27 Bridge Street, TANUNDA, SA, 5352",SA,TANUNDA,5352,Religious,Inner Regional Australia,"Yorke, Lower North & Barossa",Barossa,-34.519013,138.961928999999,12638200.28
Calvary St Catherine's Retirement Community,Calvary Aged Care Limited,#de4fbe,Residential,50,"23 McGilton Road, BERRI, SA, 5343",SA,BERRI,5343,Charitable,Outer Regional Australia,Riverland,Berri Barmera,-34.2828519999999,140.610549999999,6425408.67
Eldercare The Village,Eldercare Australia Ltd,#c94fde,Residential,60,"6-10 Centenary Avenue, MAITLAND, SA, 5573",SA,MAITLAND,5573,Charitable,Outer Regional Australia,"Yorke, Lower North & Barossa",Yorke Peninsula,-34.368803,137.675254999999,7289609.05
Eldercare Trowbridge House,Eldercare Australia Ltd,#c94fde,Residential,64,"9 LUHRS Road, PAYNEHAM SOUTH, SA, 5070",SA,PAYNEHAM SOUTH,5070,Charitable,Major Cities of Australia,Metropolitan East,Norwood Payneham and St Peters,-34.90426,138.641221999999,7383255.28
Summerhill,Clayton Church Homes Inc,#d83166,Residential,60,"1144 Greenhill Road, URAIDLA, SA, 5142",SA,URAIDLA,5142,Religious,Major Cities of Australia,"Hills, Mallee & Southern",Adelaide Hills,-34.959907,138.739387999999,5612505.2
Warrina Court Residential Aged Care Service,Warrina Homes Inc,#de7a4f,Residential,35,"46 McShane Street, CAMPBELLTOWN, SA, 5074",SA,CAMPBELLTOWN,5074,Community Based,Major Cities of Australia,Metropolitan East,Campbelltown (SA),-34.8771139999999,138.656899,4267336.72
St Raphaels Home For The Aged,Franciscan Sisters of the Heart of Jesus (South Australia) Inc,#7b31d8,Residential,33,"2 Franciscan Avenue, LOCKLEYS, SA, 5032",SA,LOCKLEYS,5032,Religious,Major Cities of Australia,Metropolitan West,West Torrens,-34.9237809999999,138.526758999999,3648678.75
Ardrossan Community Hostel,Ardrossan Community Hospital Inc,#d8b631,Residential,33,"37 Fifth Street, ARDROSSAN, SA, 5571",SA,ARDROSSAN,5571,Community Based,Outer Regional Australia,"Yorke, Lower North & Barossa",Yorke Peninsula,-34.426482,137.917597,3850764.79
Ridleyton Greek Home for the Aged,Greek Orthodox Community of SA Inc,#c18b25,Residential,120,"89 Hawker Street, BROMPTON, SA, 5007",SA,BROMPTON,5007,Religious,Major Cities of Australia,Metropolitan West,Charles Sturt,-34.8942089999999,138.573049999999,13534058.44
Estia Health Aldgate,Estia Investments Pty Ltd,#25c1b1,Residential,30,"4 Gibb Road, ALDGATE, SA, 5154",SA,ALDGATE,5154,Private Incorporated Body,Major Cities of Australia,"Hills, Mallee & Southern",Adelaide Hills,-35.0174949999999,138.738381,3695596.11
Eldercare Sash Ferguson,Eldercare Australia Ltd,#c94fde,Residential,53,"8 Fletcher Road, MOUNT BARKER, SA, 5251",SA,MOUNT BARKER,5251,Charitable,Major Cities of Australia,"Hills, Mallee & Southern",Mount Barker,-35.0743179999999,138.864889,6363647.82
Nalya Lodge Hostel,Yorke and Northern Local Health Network Incorporated,#31d887,Residential,11,"11 Hill Street, PETERBOROUGH, SA, 5422",SA,PETERBOROUGH,5422,State Government,Outer Regional Australia,Mid North,Peterborough,-32.979433,138.832896,1281103.31
Bolton Clarke Ridgehaven,RSL Care RDNS Limited,#34d831,Residential,132,"3 HAZEL Grove, RIDGEHAVEN, SA, 5097",SA,RIDGEHAVEN,5097,Charitable,Major Cities of Australia,Metropolitan North,Tea Tree Gully,-34.822541,138.700159,14909626.1
John Paul II Village Residential Care,Southern Cross Care (SA NT & VIC) Incorporated,#4f80de,Residential,40,"6a Dianne Street, KLEMZIG, SA, 5087",SA,KLEMZIG,5087,Religious,Major Cities of Australia,Metropolitan North,Port Adelaide Enfield,-34.877296,138.635532,4662593.01
Kalyra Woodcroft Aged Care,James Brown Memorial Trust,#4f61de,Residential,88,"54 Woodcroft Drive, MORPHETT VALE, SA, 5162",SA,MORPHETT VALE,5162,Charitable,Major Cities of Australia,Metropolitan South,Onkaparinga,-35.1106539999999,138.540884,10674781.59
Rembrandt Court,Rembrandt Living Incorporated,#654fde,Residential,87,"1 Madras Street, OAKLANDS PARK, SA, 5046",SA,OAKLANDS PARK,5046,Community Based,Major Cities of Australia,Metropolitan South,Marion,-35.002178,138.542698999999,9860694.37
Labrina Village Residential Care,Southern Cross Care (SA NT & VIC) Incorporated,#4f80de,Residential,41,"63-71 Labrina Avenue, PROSPECT, SA, 5082",SA,PROSPECT,5082,Religious,Major Cities of Australia,Metropolitan East,Prospect,-34.888154,138.600947999999,4720737.03
Bellevue Court Residential Care,Southern Cross Care (SA NT & VIC) Incorporated,#4f80de,Residential,80,"9 Bellevue Court, GAWLER EAST, SA, 5118",SA,GAWLER EAST,5118,Religious,Major Cities of Australia,"Yorke, Lower North & Barossa",Gawler,-34.5913609999999,138.756182999999,9247913.77
Ashman Grove Aged Care Hostel,Rosha Pty Ltd,#c6d831,Residential,87,"58 Chief Street, BROMPTON, SA, 5007",SA,BROMPTON,5007,Private Incorporated Body,Major Cities of Australia,Metropolitan West,Charles Sturt,-34.899621,138.576958999999,8461886.37
Bupa Enfield,Bupa Aged Care Australia Pty Ltd,#31d83b,Residential,68,"5 Bradford Court, ENFIELD, SA, 5085",SA,ENFIELD,5085,Private Incorporated Body,Major Cities of Australia,Metropolitan North,Port Adelaide Enfield,-34.870891,138.607071999999,8197130.92
Lutheran Homes Group Hope Valley,Lutheran Homes Group Incorporated,#31d8a8,Residential,100,"1217 Grand Junction Road, HOPE VALLEY, SA, 5090",SA,HOPE VALLEY,5090,Religious,Major Cities of Australia,Metropolitan North,Tea Tree Gully,-34.840021,138.700202999999,10717932.28
Aminya Village Hostel,Mid Murray Homes for the Aged Inc,#31d8d3,Residential,60,"14 Adelaide Road, MANNUM, SA, 5238",SA,MANNUM,5238,Community Based,Inner Regional Australia,Riverland,Mid Murray,-34.915765,139.30744,7581869.05
Amber Aged Care,Amber Aged Care Inc,#31a7d8,Residential,40,"50 Avenue Road, PARADISE, SA, 5075",SA,PARADISE,5075,Community Based,Major Cities of Australia,Metropolitan East,Campbelltown (SA),-34.871124,138.678630999999,5076840.79
Torrens Valley Aged Care,Barossa Hills Fleurieu Local Health Network Incorporated,#7831d8,Residential,42,"2 ALBERT Street, GUMERACHA, SA, 5233",SA,GUMERACHA,5233,State Government,Inner Regional Australia,"Hills, Mallee & Southern",Adelaide Hills,-34.824506,138.883837,7066365.06
Dunbar Homes Salisbury,Dunbar Homes Incorporated,#de944f,Residential,57,"11 Mawson Road, SALISBURY, SA, 5108",SA,SALISBURY,5108,Community Based,Major Cities of Australia,Metropolitan North,Salisbury,-34.764557,138.643531999999,6251799.53
St Basil's at Croydon Park,St Basil's Homes for the Aged in South Australia (Vasileias) Inc,#3133d8,Residential,81,"83-93 Regency Road, CROYDON PARK, SA, 5008",SA,CROYDON PARK,5008,Religious,Major Cities of Australia,Metropolitan West,Port Adelaide Enfield,-34.875326,138.566223,9651684.93
Edenfield Family Care,El-Jasbella Pty Ltd,#c15025,Residential,59,"20-36 Gardenia Drive, PARAFIELD GARDENS, SA, 5107",SA,PARAFIELD GARDENS,5107,Private Incorporated Body,Major Cities of Australia,Metropolitan North,Salisbury,-34.7764519999999,138.615609,5907200.99
St Anna's Residential Care Facility,Croatian Ukrainian and Belarusian Aged Care Association of SA Incorporated,#4fde5e,Residential,60,"41 Burley Griffin Boulevard, BROMPTON, SA, 5007",SA,BROMPTON,5007,Community Based,Major Cities of Australia,Metropolitan West,Charles Sturt,-34.898544,138.571124999999,7105955.74
Villa St Hilarion-Fulham,The Society of St Hilarion Inc,#674fde,Residential,56,"21 FARNCOMB Road, FULHAM, SA, 5024",SA,FULHAM,5024,Religious,Major Cities of Australia,Metropolitan West,West Torrens,-34.9300709999999,138.513921,5412206.95
Pennwood Village,Serbian Community Welfare Association of SA Inc,#c12541,Residential,61,"19 Windsor Avenue, PENNINGTON, SA, 5013",SA,PENNINGTON,5013,Community Based,Major Cities of Australia,Metropolitan West,Charles Sturt,-34.858345,138.536407999999,7341316.3
Helping Hand Aged Care - Carinya,Helping Hand Aged Care Inc,#31d853,Residential,50,"17-19 Victoria Road, CLARE, SA, 5453",SA,CLARE,5453,Charitable,Inner Regional Australia,"Yorke, Lower North & Barossa",Clare and Gilbert Valleys,-33.835793,138.611926,5865715.36
Bonney Lodge,Riverland Mallee Coorong Local Health Network Incorporated,#debe4f,Residential,81,"24 HAWDON Street, BARMERA, SA, 5345",SA,BARMERA,5345,State Government,Outer Regional Australia,Riverland,Berri Barmera,-34.249084,140.471889,8078142.13
Boandik Crouch Street,Boandik Lodge Inc,#3167d8,Residential,73,"26 Crouch Street South, MOUNT GAMBIER, SA, 5290",SA,MOUNT GAMBIER,5290,Community Based,Outer Regional Australia,South East,Mount Gambier,-37.83409,140.784428999999,8100625.92
St Basil's Aegean Village,St Basil's Homes for the Aged in South Australia (Vasileias) Inc,#3133d8,Residential,97,"10 Morton Road, CHRISTIE DOWNS, SA, 5164",SA,CHRISTIE DOWNS,5164,Religious,Major Cities of Australia,Metropolitan South,Onkaparinga,-35.1327789999999,138.498585999999,11732859.74
Copperhouse Court Hostel,Helping Hand Aged Care Inc,#31d853,Residential,57,"43 A Flinders Avenue, WHYALLA STUART, SA, 5608",SA,WHYALLA STUART,5608,Charitable,Outer Regional Australia,Eyre Peninsula,Whyalla,-33.029386,137.523160999999,7099268.11
Bene St Pauls,Italian Benevolent Foundation SA Inc,#4fdedd,Residential,80,"7 Braun Drive, HAHNDORF, SA, 5245",SA,HAHNDORF,5245,Community Based,Major Cities of Australia,"Hills, Mallee & Southern",Mount Barker,-35.0320579999999,138.81521,9025724.13
Wirraminna Care Residential Aged Care,Wirraminna Care Incorporated,#de4f8f,Residential,35,"Memorial Drive, WILLIAMSTOWN, SA, 5351",SA,WILLIAMSTOWN,5351,Community Based,Inner Regional Australia,"Yorke, Lower North & Barossa",Barossa,-34.669859,138.888330999999,4148605.61
Eldercare - South Park Minlaton,Eldercare Australia Ltd,#c94fde,Residential,18,"1 South Terrace, MINLATON, SA, 5575",SA,MINLATON,5575,Charitable,Outer Regional Australia,"Yorke, Lower North & Barossa",Yorke Peninsula,-34.774574,137.593528999999,2142382.27
AnglicareSA Elizabeth - Dutton Court,Anglicare SA Ltd,#de914f,Residential,75,"33 Catalina Road, ELIZABETH EAST, SA, 5112",SA,ELIZABETH EAST,5112,Religious,Major Cities of Australia,Metropolitan North,Playford,-34.7214439999999,138.675558999999,9283850.66
Morlancourt,RSL Care South Australia Incorporated,#774fde,Residential,61,"18 Trafford Street, ANGLE PARK, SA, 5010",SA,ANGLE PARK,5010,Community Based,Major Cities of Australia,Metropolitan West,Port Adelaide Enfield,-34.8611099999999,138.557385,7356774.08
Aldinga Beach Care Community,DPG Services Pty Ltd,#35c125,Residential,118,"10 PRIDHAM Boulevard, ALDINGA BEACH, SA, 5173",SA,ALDINGA BEACH,5173,Private Incorporated Body,Major Cities of Australia,Metropolitan South,Onkaparinga,-35.2764299999999,138.461931999999,14327479.84
Bolton Clarke Smithfield,RSL Care RDNS Limited,#34d831,Residential,74,"1 Warooka Drive, SMITHFIELD, SA, 5114",SA,SMITHFIELD,5114,Charitable,Major Cities of Australia,Metropolitan North,Playford,-34.68643,138.688051,9220268.21
Estia Health Aberfoyle Park,Estia Investments Pty Ltd,#25c1b1,Residential,92,"39 Campus Drive, ABERFOYLE PARK, SA, 5159",SA,ABERFOYLE PARK,5159,Private Incorporated Body,Major Cities of Australia,Metropolitan South,Onkaparinga,-35.068994,138.59521,10978489.26
Reynella Hillside Care Community,DPG Services Pty Ltd,#35c125,Residential,89,"7 Railway Terrace, REYNELLA, SA, 5161",SA,REYNELLA,5161,Private Incorporated Body,Major Cities of Australia,Metropolitan South,Onkaparinga,-35.0869459999999,138.544736,10743977.09
Park Village,Clayton Church Homes Inc,#d83166,Residential,60,"30 Shillabeer Road, ELIZABETH PARK, SA, 5113",SA,ELIZABETH PARK,5113,Religious,Major Cities of Australia,Metropolitan North,Playford,-34.7161869999999,138.683884,7533164.0
Warrina Park Residential Aged Care Service,Warrina Homes Inc,#de7a4f,Residential,52,"59 George Street, PARADISE, SA, 5075",SA,PARADISE,5075,Community Based,Major Cities of Australia,Metropolitan East,Campbelltown (SA),-34.868752,138.680570999999,5561047.36
Helping Hand Aged Care - Lealholme Port Pirie,Helping Hand Aged Care Inc,#31d853,Residential,90,"15 Halliday Street, PORT PIRIE, SA, 5540",SA,PORT PIRIE,5540,Charitable,Outer Regional Australia,Mid North,Port Pirie,-33.1968109999999,138.000181999999,11270646.98
Bolton Clarke Hillside,RSL Care RDNS Limited,#34d831,Residential,36,"177 Longwood Road, HEATHFIELD, SA, 5153",SA,HEATHFIELD,5153,Charitable,Major Cities of Australia,"Hills, Mallee & Southern",Adelaide Hills,-35.024948,138.720124999999,4044416.31
Eldercare Cottage Grove,Eldercare Australia Ltd,#c94fde,Residential,101,"150 Reynell Road, WOODCROFT, SA, 5162",SA,WOODCROFT,5162,Charitable,Major Cities of Australia,Metropolitan South,Onkaparinga,-35.0937339999999,138.558634,11459235.15
Strathalbyn & District Aged Care Facility,Barossa Hills Fleurieu Local Health Network Incorporated,#7831d8,Residential,92,"14 Alfred Place, STRATHALBYN, SA, 5255",SA,STRATHALBYN,5255,State Government,Inner Regional Australia,"Hills, Mallee & Southern",Alexandrina,-35.2578809999999,138.893356,10753226.01
Eldercare Goodwood,Eldercare Australia Ltd,#c94fde,Residential,100,"7 Victoria Street, GOODWOOD, SA, 5034",SA,GOODWOOD,5034,Charitable,Major Cities of Australia,Metropolitan East,Unley,-34.953957,138.588302999999,1644271.51
Eldercare Allambi,Eldercare Australia Ltd,#c94fde,Residential,225,"86 Oaklands Road, GLENGOWRIE, SA, 5044",SA,GLENGOWRIE,5044,Charitable,Major Cities of Australia,Metropolitan South,Marion,-34.995932,138.531025999999,25229935.85
Eldercare The Lodge,Eldercare Australia Ltd,#c94fde,Residential,127,"14-22 King William Road, WAYVILLE, SA, 5034",SA,WAYVILLE,5034,Charitable,Major Cities of Australia,Metropolitan East,Unley,-34.94595,138.598737999999,12718569.23
Estia Health Toorak Gardens,Estia Investments Pty Ltd,#25c1b1,Residential,36,"401 Portrush Road, TOORAK GARDENS, SA, 5065",SA,TOORAK GARDENS,5065,Private Incorporated Body,Major Cities of Australia,Metropolitan East,Burnside,-34.938124,138.641837,4470878.13
Kalyra McLaren Vale Aged Care,James Brown Memorial Trust,#4f61de,Residential,39,"19 Aldersey Street, MCLAREN VALE, SA, 5171",SA,MCLAREN VALE,5171,Charitable,Major Cities of Australia,Metropolitan South,Onkaparinga,-35.2225779999999,138.544920999999,4711813.77
Eldercare Acacia Court,Eldercare Australia Ltd,#c94fde,Residential,70,"81 Tapleys Hill Road, HENDON, SA, 5014",SA,HENDON,5014,Charitable,Major Cities of Australia,Metropolitan West,Charles Sturt,-34.8729879999999,138.513301,7801866.23
Prospect Residences,Clayton Church Homes Inc,#d83166,Residential,63,"156 Main North Road, PROSPECT, SA, 5082",SA,PROSPECT,5082,Religious,Major Cities of Australia,Metropolitan East,Prospect,-34.8854309999999,138.602348,7287484.41
Estia Health Encounter Bay,Estia Investments Pty Ltd,#25c1b1,Residential,127,"150 BAY Road, ENCOUNTER BAY, SA, 5211",SA,ENCOUNTER BAY,5211,Private Incorporated Body,Inner Regional Australia,"Hills, Mallee & Southern",Victor Harbor,-35.563291,138.598479999999,14907437.21
Wakefield Aged Care Service,Yorke and Northern Local Health Network Incorporated,#31d887,Residential,17,"23 Moorhouse Terrace, RIVERTON, SA, 5412",SA,RIVERTON,5412,State Government,Inner Regional Australia,"Yorke, Lower North & Barossa",Clare and Gilbert Valleys,-34.1601059999999,138.744326,1994077.09
Estia Health Flagstaff Hill,Estia Investments Pty Ltd,#25c1b1,Residential,85,"40 Skyline Drive, FLAGSTAFF HILL, SA, 5159",SA,FLAGSTAFF HILL,5159,Private Incorporated Body,Major Cities of Australia,Metropolitan South,Onkaparinga,-35.0426379999999,138.569851999999,10167308.3
Semaphore Residential Care Centre,Rosha Pty Ltd,#c6d831,Residential,46,"122 Esplanade -, SEMAPHORE, SA, 5019",SA,SEMAPHORE,5019,Private Incorporated Body,Major Cities of Australia,Metropolitan West,Port Adelaide Enfield,-34.833295,138.482789999999,4311804.56
Loxton District Nursing Home,Riverland Mallee Coorong Local Health Network Incorporated,#debe4f,Residential,58,"Drabsch Street, LOXTON, SA, 5333",SA,LOXTON,5333,State Government,Outer Regional Australia,Riverland,Loxton Waikerie,-34.4538099999999,140.56048,6917543.9
Estia Health Hope Valley,Estia Investments Pty Ltd,#25c1b1,Residential,101,"1099 Grand Junction Road, HOPE VALLEY, SA, 5090",SA,HOPE VALLEY,5090,Private Incorporated Body,Major Cities of Australia,Metropolitan North,Tea Tree Gully,-34.843347,138.698983999999,12314504.22
The House of Saint Hilarion,The Society of St Hilarion Inc,#674fde,Residential,120,"7 Kelly Avenue, SEATON, SA, 5023",SA,SEATON,5023,Religious,Major Cities of Australia,Metropolitan West,Charles Sturt,-34.8845809999999,138.514678,13071001.42
The Churchill Retreat,Hahndorf Holdings Pty Ltd,#2594c1,Residential,54,"470 Churchill Road, KILBURN, SA, 5084",SA,KILBURN,5084,Private Incorporated Body,Major Cities of Australia,Metropolitan North,Port Adelaide Enfield,-34.857688,138.582523,6576685.45
Sheoak Lodge,Limestone Coast Local Health Network Incorporated,#4fde85,Residential,60,"Towers Road, MILLICENT, SA, 5280",SA,MILLICENT,5280,State Government,Outer Regional Australia,South East,Wattle Range,-37.5977109999999,140.360031999999,6779796.03
Melaleuca Court Nursing Home,Yorke and Northern Local Health Network Incorporated,#31d887,Residential,35,"69 Main Street, MINLATON, SA, 5575",SA,MINLATON,5575,State Government,Outer Regional Australia,"Yorke, Lower North & Barossa",Yorke Peninsula,-34.7714089999999,137.595519999999,3296370.81
Calvary Brighton,Calvary Aged Care Limited,#de4fbe,Residential,76,"580 Brighton Road, SOUTH BRIGHTON, SA, 5048",SA,SOUTH BRIGHTON,5048,Charitable,Major Cities of Australia,Metropolitan South,Holdfast Bay,-35.0281379999999,138.52447,8267442.01
Estia Health Parkside,Estia Investments Pty Ltd,#25c1b1,Residential,40,"17 Robsart Street, PARKSIDE, SA, 5063",SA,PARKSIDE,5063,Private Incorporated Body,Major Cities of Australia,Metropolitan East,Unley,-34.9451809999999,138.619011,4552867.65
Bolton Clarke Carinya,RSL Care RDNS Limited,#34d831,Residential,56,"39 Fisher Street, MYRTLE BANK, SA, 5064",SA,MYRTLE BANK,5064,Charitable,Major Cities of Australia,Metropolitan East,Unley,-34.957158,138.631138999999,5402935.71
Glen Osmond Grove Care Community,DPG Services Pty Ltd,#35c125,Residential,84,"550 Portrush Road, GLEN OSMOND, SA, 5064",SA,GLEN OSMOND,5064,Private Incorporated Body,Major Cities of Australia,Metropolitan East,Burnside,-34.957166,138.644434999999,9898681.03
St Basil's at St Peters,St Basil's Homes for the Aged in South Australia (Vasileias) Inc,#3133d8,Residential,32,"9 Winchester Street, ST PETERS, SA, 5069",SA,ST PETERS,5069,Religious,Major Cities of Australia,Metropolitan East,Norwood Payneham and St Peters,-34.90473,138.628989999999,3447485.54
Warrina Crescent Residential Aged Care,Warrina Homes Inc,#de7a4f,Residential,140,"25 Roopena Street, INGLE FARM, SA, 5098",SA,INGLE FARM,5098,Community Based,Major Cities of Australia,Metropolitan North,Salisbury,-34.830907,138.649776,16038074.63
AnglicareSA Grange,Anglicare SA Ltd,#de914f,Residential,144,"56 High Street, GRANGE, SA, 5022",SA,GRANGE,5022,Religious,Major Cities of Australia,Metropolitan West,Charles Sturt,-34.9004649999999,138.495542999999,14943044.48
Helping Hand Aged Care - Doreen Bond House,Helping Hand Aged Care Inc,#31d853,Residential,78,"34 Molesworth Street, NORTH ADELAIDE, SA, 5006",SA,NORTH ADELAIDE,5006,Charitable,Major Cities of Australia,Metropolitan East,Adelaide,-34.9079539999999,138.587239,7544370.56
Oakden Green,Quality Care Homes Pty Ltd,#de4f70,Residential,40,"75-79 Hilltop Drive, OAKDEN, SA, 5086",SA,OAKDEN,5086,Private Incorporated Body,Major Cities of Australia,Metropolitan North,Port Adelaide Enfield,-34.851792,138.638935,5065071.79
ACH Group Residential Care - Kapara,Aged Care & Housing Group Inc,#2573c1,Residential,137,"80 MOSELEY Street, GLENELG SOUTH, SA, 5045",SA,GLENELG SOUTH,5045,Charitable,Major Cities of Australia,Metropolitan South,Holdfast Bay,-34.98962,138.514705999999,15671254.38
Resthaven Leabrook,Resthaven Inc,#de4fda,Residential,106,"336 Kensington Road, LEABROOK, SA, 5068",SA,LEABROOK,5068,Charitable,Major Cities of Australia,Metropolitan East,Burnside,-34.9266849999999,138.658645,10889528.94
Resthaven Mitcham,Resthaven Inc,#de4fda,Residential,118,"17 Hill Street, KINGSWOOD, SA, 5062",SA,KINGSWOOD,5062,Charitable,Major Cities of Australia,Metropolitan South,Mitcham,-34.975163,138.617516999999,12066794.95
Resthaven Malvern,Resthaven Inc,#de4fda,Residential,77,"43 Marlborough Street, MALVERN, SA, 5061",SA,MALVERN,5061,Charitable,Major Cities of Australia,Metropolitan East,Unley,-34.958832,138.611498,7956049.16
