Martin Luther Homes,Martin Luther Homes Boronia Inc,#4fa7de,Residential,147,"67 Mount View Road, THE BASIN, VIC, 3154",VIC,THE BASIN,3154,Religious,Major Cities of Australia,Eastern Metro,Knox,-37.8605689999999,145.303842,8972829.49
Samarinda Lodge,Boroondara Aged Services Society,#d83190,Residential,92,"286 High Street, ASHBURTON, VIC, 3147",VIC,ASHBURTON,3147,Community Based,Major Cities of Australia,Eastern Metro,Boroondara,-37.864373,145.085814999999,8561105.26
Estia Health Knoxfield,Estia Investments Pty Ltd,#25c1b1,Residential,54,"428 Scoresby Road, KNOXFIELD, VIC, 3180",VIC,KNOXFIELD,3180,Private Incorporated Body,Major Cities of Australia,Eastern Metro,Knox,-37.882911,145.254375,5849403.59
Isomer Aged Care Facility,Islamic Society of Melbourne Eastern Regions Inc,#6625c1,Residential,50,"1273 Wellington Road, LYSTERFIELD, VIC, 3156",VIC,LYSTERFIELD,3156,Religious,Major Cities of Australia,Eastern Metro,Knox,-37.928612,145.271151,4004286.66
Willaura Aged Care,East Grampians Health Service,#d8313b,Residential,12,"21 DELACOMBE Way, WILLAURA, VIC, 3379",VIC,WILLAURA,3379,State Government,Outer Regional Australia,Grampians,Ararat,-37.5463409999999,142.745767,953002.78
Willowbrae - Melton,Norsan Pty Ltd,#89d831,Residential,60,"116 Centenary Avenue, MELTON, VIC, 3337",VIC,MELTON,3337,Private Incorporated Body,Major Cities of Australia,Western Metro,Melton,-37.673493,144.577164,6809554.17
Laurina Lodge Hostel,Heyfield Hospital Incorporated,#31cbd8,Residential,51,"1 ELEANOR Street, HEYFIELD, VIC, 3858",VIC,HEYFIELD,3858,Community Based,Inner Regional Australia,Gippsland,Wellington,-37.9758709999999,146.783688,5899498.63
Yackandandah Health Residential Aged Care,Apollo Care Operations Pty Ltd,#255fc1,Residential,84,"20 Isaacs Avenue, YACKANDANDAH, VIC, 3749",VIC,YACKANDANDAH,3749,Private Incorporated Body,Inner Regional Australia,Hume,Indigo,-36.310037,146.845499999999,9109975.74
Arcare Portarlington,Arcare Pty Ltd,#7325c1,Residential,100,"80 Willis Street, PORTARLINGTON, VIC, 3223",VIC,PORTARLINGTON,3223,Private Incorporated Body,Inner Regional Australia,Barwon-South Western,Greater Geelong,-38.1194539999999,144.656130999999,10615713.28
Hillview Bunyip Aged Care Inc,Hillview Bunyip Aged Care Inc,#3139d8,Residential,58,"22 Abeckett Road, BUNYIP, VIC, 3815",VIC,BUNYIP,3815,Community Based,Inner Regional Australia,Southern Metro,Cardinia,-38.09628,145.725095,6795846.92
Oaklea Hall,Aged Care Group Pty Ltd,#4fde5b,Residential,46,"4-8 Earlstown Road, OAKLEIGH, VIC, 3166",VIC,OAKLEIGH,3166,Private Incorporated Body,Major Cities of Australia,Eastern Metro,Monash,-37.899467,145.085326,5566507.2
mecwacare Rositano House,MECWA,#de514f,Residential,30,"273 Church Street, RICHMOND, VIC, 3121",VIC,RICHMOND,3121,Community Based,Major Cities of Australia,Northern Metro,Yarra,-37.820196,144.999117,3741417.37
Monda Lodge Hostel,Eastern Health,#7625c1,Residential,30,"32-36 McGregor Avenue, HEALESVILLE, VIC, 3777",VIC,HEALESVILLE,3777,State Government,Inner Regional Australia,Eastern Metro,Yarra Ranges,-37.6452079999999,145.528198,1151733.42
Fairway Bayside Aged Care,Fairway Bayside Aged Care,#c1256f,Residential,65,"195 Bluff Road, SANDRINGHAM, VIC, 3191",VIC,SANDRINGHAM,3191,Community Based,Major Cities of Australia,Southern Metro,Bayside (Vic.),-37.959941,145.01828,6452367.69
Mercy Place Templestowe,Mercy Aged and Community Care Ltd,#4fdeaa,Residential,52,"16 Herlihys Road, TEMPLESTOWE LOWER, VIC, 3107",VIC,TEMPLESTOWE LOWER,3107,Charitable,Major Cities of Australia,Eastern Metro,Manningham,-37.7605239999999,145.122144999999,5458967.55
Oxa Care,Oxha Health Pty Ltd,#4f5ede,Residential,240,"513 High Street, EPPING, VIC, 3076",VIC,EPPING,3076,Private Incorporated Body,Major Cities of Australia,Northern Metro,Whittlesea,-37.6581809999999,145.019425,19176532.33
Cobden District Health Services,Cobden District Health Services Inc,#4fdec9,Residential,60,"5 Victoria Street, COBDEN, VIC, 3266",VIC,COBDEN,3266,Community Based,Inner Regional Australia,Barwon-South Western,Corangamite,-38.3322349999999,143.0763,6443408.11
Clarendon Grange Hostel,Wickro Pty Ltd,#c13425,Residential,47,"40 Stud Road, WANTIRNA, VIC, 3152",VIC,WANTIRNA,3152,Private Incorporated Body,Major Cities of Australia,Eastern Metro,Knox,-37.846116,145.246622,5301099.67
Queen Elizabeth Village Hostel,Grampians Health,#b225c1,Residential,45,"302 Gillies Street, North, WENDOUREE, VIC, 3355",VIC,WENDOUREE,3355,State Government,Inner Regional Australia,Grampians,Ballarat,-37.536245,143.823029999999,5081017.56
Doutta Galla Grantham Green Aged Care Facility,Doutta Galla Aged Services Ltd,#de4f87,Residential,44,"28-32 Magnolia Street, ST ALBANS, VIC, 3021",VIC,ST ALBANS,3021,Charitable,Major Cities of Australia,Western Metro,Brimbank,-37.7530829999999,144.820778999999,5185269.31
Villa Maria Catholic Homes Justin Villa Aged Care Residence,Villa Maria Catholic Homes Limited,#c125b2,Residential,17,"2 Caravan Street, BALWYN, VIC, 3103",VIC,BALWYN,3103,Charitable,Major Cities of Australia,Eastern Metro,Boroondara,-37.8053809999999,145.095122,1170247.03
Arcare Cheltenham,Arcare Pty Ltd,#7325c1,Residential,90,"161A Centre Dandenong Road, CHELTENHAM, VIC, 3192",VIC,CHELTENHAM,3192,Private Incorporated Body,Major Cities of Australia,Southern Metro,Kingston (Vic.),-37.967784,145.075837,9556446.97
Lifeview Argyle Court,Chevron Corporation Pty Ltd,#4f88de,Residential,45,"81-83 Argyle Avenue, CHELSEA, VIC, 3196",VIC,CHELSEA,3196,Private Incorporated Body,Major Cities of Australia,Southern Metro,Kingston (Vic.),-38.052612,145.127941999999,5112688.77
Calvary Kingston Gardens,Calvary Aged Care Limited,#de4fbe,Residential,128,"173-213 Clarke Road, SPRINGVALE SOUTH, VIC, 3172",VIC,SPRINGVALE SOUTH,3172,Charitable,Major Cities of Australia,Southern Metro,Greater Dandenong,-37.974812,145.144835,14136378.17
Croydon Grove Care Community,DPG Services Pty Ltd,#35c125,Residential,60,"77-115 Mount Dandenong Road, CROYDON, VIC, 3136",VIC,CROYDON,3136,Private Incorporated Body,Major Cities of Australia,Eastern Metro,Maroondah,-37.7994089999999,145.270432999999,6561803.09
Cheltenham Parkside Care Community,DPG Services Pty Ltd,#35c125,Residential,45,"13 Eagland Road, CHELTENHAM, VIC, 3192",VIC,CHELTENHAM,3192,Private Incorporated Body,Major Cities of Australia,Southern Metro,Kingston (Vic.),-37.971397,145.075934999999,5147393.92
Greenwood Manor,Greenwood Manor Pty Ltd,#314ed8,Residential,62,"617 Lower Dandenong Road, DINGLEY VILLAGE, VIC, 3172",VIC,DINGLEY VILLAGE,3172,Private Incorporated Body,Major Cities of Australia,Southern Metro,Kingston (Vic.),-37.989978,145.138408999999,4564276.42
Regis Rosebud,Regis Aged Care Pty Ltd,#c12569,Residential,129,"1 Wyuna Street, CAPEL SOUND, VIC, 3940",VIC,CAPEL SOUND,3940,Private Incorporated Body,Major Cities of Australia,Southern Metro,Mornington Peninsula,-38.3704779999999,144.883026999999,11520015.25
Sutherland Lodge,Bairnsdale Regional Health Service,#53d831,Residential,32,"125 McKean Street, BAIRNSDALE, VIC, 3875",VIC,BAIRNSDALE,3875,State Government,Outer Regional Australia,Gippsland,East Gippsland,-37.832776,147.606002999999,3728479.25
The Lakes Hostel,Grampians Health,#b225c1,Residential,22,"107-115 Lake Street, EDENHOPE, VIC, 3318",VIC,EDENHOPE,3318,State Government,Outer Regional Australia,Grampians,West Wimmera,-37.0348729999999,141.289197,2792769.57
Estia Health Bentleigh,Estia Investments Pty Ltd,#25c1b1,Residential,45,"34-36 Clairmont Avenue, BENTLEIGH, VIC, 3204",VIC,BENTLEIGH,3204,Private Incorporated Body,Major Cities of Australia,Southern Metro,Glen Eira,-37.921903,145.026873999999,5344997.37
Willowbrae-Templestowe Hostel,Menarock Aged Care Services (Victoria) Pty Ltd,#2d25c1,Residential,64,"81-85 Porter Street, TEMPLESTOWE, VIC, 3106",VIC,TEMPLESTOWE,3106,Private Incorporated Body,Major Cities of Australia,Eastern Metro,Manningham,-37.752192,145.133888,5701559.84
Arcare Reservoir,Arcare Pty Ltd,#7325c1,Residential,69,"2 Gremel Road, RESERVOIR, VIC, 3073",VIC,RESERVOIR,3073,Private Incorporated Body,Major Cities of Australia,Northern Metro,Darebin,-37.725413,145.029948999999,7913136.51
Calvary Elouera,Calvary Aged Care Limited,#de4fbe,Residential,75,"6-11 Kooringa Place, TORQUAY, VIC, 3228",VIC,TORQUAY,3228,Charitable,Inner Regional Australia,Barwon-South Western,Surf Coast,-38.3244279999999,144.315579,6619737.31
Cheltenham Manor,Cheltenham Manor Pty Ltd,#a5d831,Residential,155,"10-12 Bendigo Street, CHELTENHAM, VIC, 3192",VIC,CHELTENHAM,3192,Private Incorporated Body,Major Cities of Australia,Southern Metro,Kingston (Vic.),-37.964255,145.059497999999,13644355.03
Liscombe House,The Old Colonists' Association of Victoria,#3185d8,Residential,81,"339 St Helena Road, SAINT HELENA, VIC, 3088",VIC,SAINT HELENA,3088,Charitable,Major Cities of Australia,Northern Metro,Banyule,-37.6890089999999,145.132577999999,8792604.58
Lyrebird Village,Respect Group Limited,#31d8ab,Residential,98,"8 Neerim Street, DROUIN, VIC, 3818",VIC,DROUIN,3818,Charitable,Inner Regional Australia,Gippsland,Baw Baw,-38.134686,145.864676,11043727.23
Hailey House Hostel,Grampians Health,#b225c1,Residential,60,"703 NORMAN Street, BALLARAT NORTH, VIC, 3350",VIC,BALLARAT NORTH,3350,State Government,Inner Regional Australia,Grampians,Ballarat,-37.5364909999999,143.857801999999,6806332.37
Avoca Hostel,Maryborough District Health Service,#c12558,Residential,10,"10 Templeton Street, AVOCA, VIC, 3467",VIC,AVOCA,3467,State Government,Inner Regional Australia,Grampians,Pyrenees,-37.092419,143.468565,1111885.45
mecwacare Ballan Aged Care Facility,MECWA,#de514f,Residential,51,"168 Inglis Street, BALLAN, VIC, 3342",VIC,BALLAN,3342,Community Based,Inner Regional Australia,Grampians,Moorabool,-37.5999529999999,144.221765,4807180.48
Coptic Hostel,Coptic Village Hostel Inc,#de824f,Residential,52,"18 St Kyrillos Place, NARRE WARREN, VIC, 3805",VIC,NARRE WARREN,3805,Religious,Major Cities of Australia,Southern Metro,Casey,-38.0050329999999,145.287058999999,6210351.33
Mercy Place Ave Maria,Mercy Aged and Community Care Ltd,#4fdeaa,Residential,91,"25 Graham Street, SHEPPARTON, VIC, 3630",VIC,SHEPPARTON,3630,Charitable,Inner Regional Australia,Hume,Greater Shepparton,-36.361691,145.405653999999,10378011.0
Bolga Court Hostel,Tallangatta Health Service,#6c25c1,Residential,36,"1 Lakeside Drive, TALLANGATTA, VIC, 3700",VIC,TALLANGATTA,3700,State Government,Outer Regional Australia,Hume,Towong,-36.212823,147.181830999999,3792257.53
James Thomas Court,Grampians Health,#b225c1,Residential,34,"117 Morgan Street, SEBASTOPOL, VIC, 3356",VIC,SEBASTOPOL,3356,State Government,Inner Regional Australia,Grampians,Ballarat,-37.6048759999999,143.835707,3880299.41
RM Begg,Respect Group Limited,#31d8ab,Residential,90,"27-35 Epping Street, KYNETON, VIC, 3444",VIC,KYNETON,3444,Charitable,Inner Regional Australia,Loddon-Mallee,Macedon Ranges,-37.2517289999999,144.461163999999,9649259.98
Warrina Hostel,Yarrawonga Health,#6dd831,Residential,28,"26 Piper Street, YARRAWONGA, VIC, 3730",VIC,YARRAWONGA,3730,State Government,Inner Regional Australia,Hume,Moira,-36.010874,146.005718,3022198.5
Princes Court Homes Hostel,Princes Court Ltd,#524fde,Residential,102,"27 Princes Street, MILDURA, VIC, 3500",VIC,MILDURA,3500,Community Based,Outer Regional Australia,Loddon-Mallee,Mildura,-34.1922459999999,142.148967999999,11123850.2
Warramunda Village Hostel,Warramunda Village Ltd,#51c125,Residential,82,"Warramunda Drive, KYABRAM, VIC, 3620",VIC,KYABRAM,3620,Community Based,Inner Regional Australia,Loddon-Mallee,Campaspe,-36.31692,145.041876,9402561.23
Bindaree Retirement Centre,Mansfield District Hospital,#d85531,Residential,42,"86 Highett Street, MANSFIELD, VIC, 3722",VIC,MANSFIELD,3722,State Government,Outer Regional Australia,Hume,Mansfield,-37.0606379999999,146.086768,3396289.13
Cooinda Village Inc,Cooinda Village Inc,#de4f9a,Residential,83,"1 -35 Kilfeera Road, BENALLA, VIC, 3672",VIC,BENALLA,3672,Community Based,Inner Regional Australia,Hume,Benalla,-36.5564449999999,145.997692,8042196.67
Lutheran Homes Hamilton,Lutheran Homes Group Incorporated,#31d8a8,Residential,59,"72 Ballarat Road, HAMILTON, VIC, 3300",VIC,HAMILTON,3300,Religious,Inner Regional Australia,Barwon-South Western,Southern Grampians,-37.744041,142.040710999999,6078752.57
Mercy Place Lynbrook,Mercy Aged and Community Care Ltd,#4fdeaa,Residential,96,"500 Evans Road, LYNBROOK, VIC, 3975",VIC,LYNBROOK,3975,Charitable,Major Cities of Australia,Southern Metro,Casey,-38.0645919999999,145.261665999999,12292611.21
Numurkah Pioneers Memorial Lodge,NCN Health,#be31d8,Residential,36,"13 Katamatite-Nathalia Road, NUMURKAH, VIC, 3636",VIC,NUMURKAH,3636,State Government,Inner Regional Australia,Hume,Moira,-36.099038,145.445135999999,3844458.89
Johnson-Goodwin Memorial Homes,Johnson-Goodwin Memorial Homes,#de974f,Residential,38,"22 Camp Street, DONALD, VIC, 3480",VIC,DONALD,3480,Community Based,Outer Regional Australia,Loddon-Mallee,Buloke,-36.3708,142.977485999999,3986210.42
Aeralife Twin Parks,Milford Hall Pty Ltd,#314bd8,Residential,136,"33-45 Blake Street, RESERVOIR, VIC, 3073",VIC,RESERVOIR,3073,Private Incorporated Body,Major Cities of Australia,Northern Metro,Darebin,-37.7321659999999,145.036991,13681480.03
Boort District Health Loddon Place,Boort District Health,#25abc1,Residential,28,"5 Kiniry Street, BOORT, VIC, 3537",VIC,BOORT,3537,State Government,Outer Regional Australia,Loddon-Mallee,Loddon,-36.1151699999999,143.727194999999,1775207.89
Baptcare - Northaven Community,Baptcare Ltd,#317cd8,Residential,56,"84-86 Shadforth Street, KERANG, VIC, 3579",VIC,KERANG,3579,Religious,Outer Regional Australia,Loddon-Mallee,Gannawarra,-35.7261049999999,143.915706999999,5949893.63
Moyola Lodge Hostel,Moyola Aged Care Incorporated,#c125b8,Residential,43,"60 Hunter Street, TATURA, VIC, 3616",VIC,TATURA,3616,Community Based,Inner Regional Australia,Hume,Greater Shepparton,-36.4383849999999,145.224314999999,4588506.22
Lumeah Lodge Hostel,Central Highlands Rural Health,#c125be,Residential,12,"13 HOSPITAL Street, DAYLESFORD, VIC, 3460",VIC,DAYLESFORD,3460,State Government,Inner Regional Australia,Grampians,Hepburn,-37.337496,144.145251,1227640.17
St Vincent's Care Services Eltham - Willandra Lodge,St Vincent's Care Services Ltd,#86d831,Residential,64,"43 Diamond Street, ELTHAM, VIC, 3095",VIC,ELTHAM,3095,Religious,Major Cities of Australia,Northern Metro,Nillumbik,-37.7121879999999,145.145761999999,6542929.85
BSL Aged Care - Clifton Hill,Brotherhood of St Laurence,#bad831,Residential,117,"160 Gold Street, CLIFTON HILL, VIC, 3068",VIC,CLIFTON HILL,3068,Religious,Major Cities of Australia,Northern Metro,Yarra,-37.792541,144.990451,18091590.67
John Curtin Aged Care,John Curtin Aged Care Inc,#de4f85,Residential,65,"5 Cushing Avenue, CRESWICK, VIC, 3363",VIC,CRESWICK,3363,Community Based,Inner Regional Australia,Grampians,Hepburn,-37.4206369999999,143.891673999999,7199033.23
Kellock Lodge,Kellock Lodge Alexandra Inc,#4fccde,Residential,50,"15 Bon Street, ALEXANDRA, VIC, 3714",VIC,ALEXANDRA,3714,Charitable,Inner Regional Australia,Hume,Murrindindi,-37.185569,145.711934,5297384.12
Wintringham Hostel - Port Melbourne,WINTRINGHAM LIMITED,#31acd8,Residential,35,"79 Swallow Street, PORT MELBOURNE, VIC, 3207",VIC,PORT MELBOURNE,3207,Charitable,Major Cities of Australia,Southern Metro,Port Phillip,-37.837856,144.93252,5357702.82
Wintringham McLean Lodge Hostel,WINTRINGHAM LIMITED,#31acd8,Residential,27,"1-2 Little Princes Street, FLEMINGTON, VIC, 3031",VIC,FLEMINGTON,3031,Charitable,Major Cities of Australia,Western Metro,Moonee Valley,-37.783346,144.936124,4132518.54
Mayflower Edith Bendall,Mayflower Reservoir,#de4fcb,Residential,60,"11 Park Street, PASCOE VALE, VIC, 3044",VIC,PASCOE VALE,3044,Charitable,Major Cities of Australia,Northern Metro,Merri-bek,-37.729078,144.925624999999,6307893.78
Villa Maria Catholic Homes St Bernadette's Aged Care Residence,Villa Maria Catholic Homes Limited,#c125b2,Residential,89,"17 Park Drive, SUNSHINE NORTH, VIC, 3020",VIC,SUNSHINE NORTH,3020,Charitable,Major Cities of Australia,Western Metro,Brimbank,-37.7594679999999,144.825453,10076082.84
Lakeview Lodge Hostel,Nagambie HealthCare Incorporated,#57c125,Residential,53,"22 Church Street, NAGAMBIE, VIC, 3608",VIC,NAGAMBIE,3608,Community Based,Inner Regional Australia,Hume,Strathbogie,-36.780884,145.14981,6155517.59
Warrnambool Riverside Care Community,DPG Services Pty Ltd,#35c125,Residential,84,"62-76 Huntingfield Drive, WARRNAMBOOL, VIC, 3280",VIC,WARRNAMBOOL,3280,Private Incorporated Body,Inner Regional Australia,Barwon-South Western,Warrnambool,-38.386819,142.530909,9240388.93
Estia Health Leopold,Estia Investments Pty Ltd,#25c1b1,Residential,75,"52-60 Ash Road, LEOPOLD, VIC, 3224",VIC,LEOPOLD,3224,Private Incorporated Body,Major Cities of Australia,Barwon-South Western,Greater Geelong,-38.195559,144.467470999999,7030754.3
St Paul's Hostel for the Elderly,Antonine Sisters Aged Care Services Ltd,#aede4f,Residential,60,"15-17 Strettle Street, THORNBURY, VIC, 3071",VIC,THORNBURY,3071,Religious,Major Cities of Australia,Northern Metro,Darebin,-37.754092,144.983261999999,6418411.31
Trentham Hostel,Central Highlands Rural Health,#c125be,Residential,20,"22-24 Victoria Street, TRENTHAM, VIC, 3458",VIC,TRENTHAM,3458,State Government,Inner Regional Australia,Grampians,Hepburn,-37.3867359999999,144.327598999999,2003820.71
Beaufort Hostel,Beaufort & Skipton Health Service,#4fde92,Residential,12,"1-3 Burton Street, BEAUFORT, VIC, 3373",VIC,BEAUFORT,3373,State Government,Inner Regional Australia,Grampians,Pyrenees,-37.431663,143.381952,1676075.28
McLellan House Hostel,Northern Health,#31b2d8,Residential,32,"2 Robinson Street, JACANA, VIC, 3047",VIC,JACANA,3047,State Government,Major Cities of Australia,Northern Metro,Hume,-37.68582,144.912655999999,2829826.07
Calvary Vonlea Manor,Calvary Aged Care Limited,#de4fbe,Residential,38,"1-9 Moran Place, NORLANE, VIC, 3214",VIC,NORLANE,3214,Charitable,Major Cities of Australia,Barwon-South Western,Greater Geelong,-38.094394,144.345462999999,4678475.25
Ottrey Lodge,Ottrey Homes - Cobram And District Retirement Village Inc,#c12590,Residential,101,"16 Campbell Road, COBRAM, VIC, 3644",VIC,COBRAM,3644,Community Based,Inner Regional Australia,Hume,Moira,-35.9197729999999,145.660054,9694226.44
Bolton Clarke The Ashley,RSL Care RDNS Limited,#34d831,Residential,65,"17-21 Ashley Street, RESERVOIR, VIC, 3073",VIC,RESERVOIR,3073,Charitable,Major Cities of Australia,Northern Metro,Darebin,-37.71795,145.001898,7306830.3
Heathcote Health Low Care Service,Heathcote Health,#4f86de,Residential,30,"39 Hospital Street, HEATHCOTE, VIC, 3523",VIC,HEATHCOTE,3523,State Government,Inner Regional Australia,Loddon-Mallee,Greater Bendigo,-36.925604,144.709705,3240289.09
Eventide Homes (Stawell) Inc,Eventide Homes (Stawell) Inc,#2548c1,Residential,100,"111 Patrick Street, STAWELL, VIC, 3380",VIC,STAWELL,3380,Charitable,Inner Regional Australia,Grampians,Northern Grampians,-37.063561,142.791825999999,8966980.44
Lyndoch Hostel,Respect Group Limited,#31d8ab,Residential,115,"Hopkins Road, WARRNAMBOOL, VIC, 3280",VIC,WARRNAMBOOL,3280,Charitable,Inner Regional Australia,Barwon-South Western,Warrnambool,-38.3967609999999,142.506860999999,12859930.2
Maculata Place,Shepparton Retirement Villages Inc,#d9de4f,Residential,120,"124 Maculata Drive, SHEPPARTON, VIC, 3630",VIC,SHEPPARTON,3630,Charitable,Inner Regional Australia,Hume,Greater Shepparton,-36.3642299999999,145.39258,13650322.0
mecwacare Elstoft House,MECWA,#de514f,Residential,91,"12-14 Beulah Street, HAMLYN HEIGHTS, VIC, 3215",VIC,HAMLYN HEIGHTS,3215,Community Based,Major Cities of Australia,Barwon-South Western,Greater Geelong,-38.1200499999999,144.323483,10383066.81
Uniting AgeWell Kingsville,Uniting Agewell Limited,#de684f,Residential,72,"319 Geelong Road, KINGSVILLE, VIC, 3012",VIC,KINGSVILLE,3012,Religious,Major Cities of Australia,Western Metro,Maribyrnong,-37.807507,144.876971999999,8074348.9
The Sydney-Lynne Quayle & Fitzroy Lodge Hostels,Heywood Rural Health,#de4fa9,Residential,45,"21 Barclay Street, HEYWOOD, VIC, 3304",VIC,HEYWOOD,3304,State Government,Outer Regional Australia,Barwon-South Western,Glenelg,-38.136946,141.624720999999,5788557.66
Moyne Health Services-Moyneyana House,Moyne Health Services,#4fdebc,Residential,52,"31 COLLEGE Street, PORT FAIRY, VIC, 3284",VIC,PORT FAIRY,3284,State Government,Inner Regional Australia,Barwon-South Western,Moyne,-38.3834719999999,142.226088,5509413.02
Uniting AgeWell Kalkee Murray,Uniting Agewell Limited,#de684f,Residential,40,"9 Spring Street, BELMONT, VIC, 3216",VIC,BELMONT,3216,Religious,Major Cities of Australia,Barwon-South Western,Greater Geelong,-38.180567,144.348643,4352383.57
Holloway Aged Care Services,Holloway Aged Care Services Incorporated,#de724f,Residential,77,"1 Rotary Drive, KEILOR EAST, VIC, 3033",VIC,KEILOR EAST,3033,Community Based,Major Cities of Australia,Western Metro,Moonee Valley,-37.746934,144.862049,7025259.42
Mooroopna Place Residential Aged Care Service,Shepparton Retirement Villages Inc,#d9de4f,Residential,105,"30-50 Knight Street, MOOROOPNA, VIC, 3629",VIC,MOOROOPNA,3629,Charitable,Inner Regional Australia,Hume,Greater Shepparton,-36.3863369999999,145.351791999999,11916025.48
Allawah Special Care Hostel,Yarrawonga Health,#6dd831,Residential,30,"42 HUME Street, YARRAWONGA, VIC, 3730",VIC,YARRAWONGA,3730,State Government,Inner Regional Australia,Hume,Moira,-36.0123979999999,146.006146,3217290.21
Kaniva Hostel,West Wimmera Health Service,#d83159,Residential,10,"7 Farmers Street, KANIVA, VIC, 3419",VIC,KANIVA,3419,State Government,Outer Regional Australia,Grampians,West Wimmera,-36.3814769999999,141.245743,669821.72
Assisi Centre Aged Care,Assisi Centre Limited,#3191d8,Residential,150,"230 Rosanna Road, ROSANNA, VIC, 3084",VIC,ROSANNA,3084,Religious,Major Cities of Australia,Northern Metro,Banyule,-37.7410369999999,145.073836,13932111.11
Inglewood & Districts Health Service Hostel,Inglewood & Districts Health Service,#d8314d,Residential,20,"3 Hospital Street, INGLEWOOD, VIC, 3517",VIC,INGLEWOOD,3517,State Government,Inner Regional Australia,Loddon-Mallee,Loddon,-36.5725849999999,143.873393999999,1725451.32
Doutta Galla Lynch's Bridge Aged Care Facility,Doutta Galla Aged Services Ltd,#de4f87,Residential,58,"44 Market Street, KENSINGTON, VIC, 3031",VIC,KENSINGTON,3031,Charitable,Major Cities of Australia,Western Metro,Melbourne,-37.789883,144.926735,6711082.74
Eureka Village Hostel,Grampians Health,#b225c1,Residential,45,"16-40 Balmoral Drive, BALLARAT EAST, VIC, 3350",VIC,BALLARAT EAST,3350,State Government,Inner Regional Australia,Grampians,Ballarat,-37.5598749999999,143.88963,5476943.4
Vasey RSL Care Bundoora,Vasey RSL Care Ltd,#4725c1,Residential,90,"5-7 Tower Avenue, BUNDOORA, VIC, 3083",VIC,BUNDOORA,3083,Community Based,Major Cities of Australia,Northern Metro,Darebin,-37.702832,145.054676999999,9117507.56
Malvern East Horizons Care Community,DPG Services Pty Ltd,#35c125,Residential,112,"235 WAVERLEY Road, MALVERN EAST, VIC, 3145",VIC,MALVERN EAST,3145,Private Incorporated Body,Major Cities of Australia,Southern Metro,Stonnington,-37.878214,145.066624999999,10324936.47
Allambee Nursing Home Kingston Centre,Monash Health,#25c168,Residential,35,"376 Warrigal Road, CHELTENHAM, VIC, 3192",VIC,CHELTENHAM,3192,State Government,Major Cities of Australia,Southern Metro,Kingston (Vic.),-37.9575499999999,145.078759999999,4042589.14
Coppin Centre,Royal Freemasons Ltd,#4fa4de,Residential,207,"45 Moubray Street, MELBOURNE, VIC, 3004",VIC,MELBOURNE,3004,Charitable,Major Cities of Australia,Western Metro,Melbourne,-37.8476849999999,144.984464,19481198.95
Boollam Boollam Aged Care Centre,Monash Health,#25c168,Residential,100,"376 Warrigal Road, CHELTENHAM, VIC, 3192",VIC,CHELTENHAM,3192,State Government,Major Cities of Australia,Southern Metro,Kingston (Vic.),-37.9575499999999,145.078759999999,0.0
Mooraleigh Hostel,Monash Health,#25c168,Residential,29,"748 Centre Road, BENTLEIGH EAST, VIC, 3165",VIC,BENTLEIGH EAST,3165,State Government,Major Cities of Australia,Southern Metro,Glen Eira,-37.921796,145.062735,3233864.27
Victorian Elderly Chinese Hostel,Victorian Elderly Chinese Welfare Society Inc,#4fdec1,Residential,31,"77 Hurtle Street, ASCOT VALE, VIC, 3032",VIC,ASCOT VALE,3032,Community Based,Major Cities of Australia,Western Metro,Moonee Valley,-37.7744259999999,144.906002,4040598.52
Yarriambiack Lodge Hostel,Rural Northwest Health,#315dd8,Residential,30,"18 Dimboola Road, WARRACKNABEAL, VIC, 3393",VIC,WARRACKNABEAL,3393,State Government,Outer Regional Australia,Grampians,Yarriambiack,-36.2524999999999,142.381912999999,2518399.23
Doutta Galla Woornack Aged Care Facility,Doutta Galla Aged Services Ltd,#de4f87,Residential,63,"6-8 Killara Street, SUNSHINE WEST, VIC, 3020",VIC,SUNSHINE WEST,3020,Charitable,Major Cities of Australia,Western Metro,Brimbank,-37.787495,144.823272,7647415.11
Kurrajong Lodge,Grampians Health,#b225c1,Residential,36,"2 ARNOTT Street, HORSHAM, VIC, 3400",VIC,HORSHAM,3400,State Government,Outer Regional Australia,Grampians,Horsham,-36.7140619999999,142.208729,4031575.68
Doutta Galla Yarraville Village Aged Care Facility,Doutta Galla Aged Services Ltd,#de4f87,Residential,48,"34 A Somerville Road, YARRAVILLE, VIC, 3013",VIC,YARRAVILLE,3013,Charitable,Major Cities of Australia,Western Metro,Maribyrnong,-37.8135219999999,144.892977999999,4925229.95
Andrews House,West Gippsland Healthcare Group,#2577c1,Residential,51,"42 School Road, TRAFALGAR, VIC, 3824",VIC,TRAFALGAR,3824,State Government,Inner Regional Australia,Gippsland,Baw Baw,-38.2137529999999,146.150989,5411907.35
Bupa Windsor,Bupa Aged Care Australia Pty Ltd,#31d83b,Residential,41,"102-104 Union Street, WINDSOR, VIC, 3181",VIC,WINDSOR,3181,Private Incorporated Body,Major Cities of Australia,Southern Metro,Stonnington,-37.854294,144.988699999999,4292298.52
